{
  "schema_version": 1,
  "source": {
    "sha": "456b87b9d194323bdd70d88f7bbf6f1f70795133"
  },
  "tag": "v0.1.3",
  "targets": [
    {
      "archive": {
        "name": "rune-0.1.3-aarch64-apple-darwin.tar.gz",
        "sha256": "82e02b760765d6af8ef73fc8043773ed1f4ddb2add0e7006a4ecc0a1535041c2"
      },
      "checksum": "rune-0.1.3-aarch64-apple-darwin.tar.gz.sha256",
      "metadata": "rune-0.1.3-aarch64-apple-darwin.metadata.json",
      "notices": "rune-0.1.3-aarch64-apple-darwin.notices.json",
      "provenance": "rune-0.1.3-aarch64-apple-darwin.provenance.json",
      "release_metadata": "rune-0.1.3-aarch64-apple-darwin.release-metadata.json",
      "sbom": "rune-0.1.3-aarch64-apple-darwin.sbom.json",
      "target": "aarch64-apple-darwin"
    },
    {
      "archive": {
        "name": "rune-0.1.3-aarch64-unknown-linux-gnu.tar.gz",
        "sha256": "011307c0a829e72ded1fcc090e7fe37189684cfed5249a23c7969d10c2e659c8"
      },
      "checksum": "rune-0.1.3-aarch64-unknown-linux-gnu.tar.gz.sha256",
      "metadata": "rune-0.1.3-aarch64-unknown-linux-gnu.metadata.json",
      "notices": "rune-0.1.3-aarch64-unknown-linux-gnu.notices.json",
      "provenance": "rune-0.1.3-aarch64-unknown-linux-gnu.provenance.json",
      "release_metadata": "rune-0.1.3-aarch64-unknown-linux-gnu.release-metadata.json",
      "sbom": "rune-0.1.3-aarch64-unknown-linux-gnu.sbom.json",
      "target": "aarch64-unknown-linux-gnu"
    },
    {
      "archive": {
        "name": "rune-0.1.3-x86_64-apple-darwin.tar.gz",
        "sha256": "ecb5a1a5f9f6669245841d1a499a094b082a45ccc734bf389141f4257ce304fd"
      },
      "checksum": "rune-0.1.3-x86_64-apple-darwin.tar.gz.sha256",
      "metadata": "rune-0.1.3-x86_64-apple-darwin.metadata.json",
      "notices": "rune-0.1.3-x86_64-apple-darwin.notices.json",
      "provenance": "rune-0.1.3-x86_64-apple-darwin.provenance.json",
      "release_metadata": "rune-0.1.3-x86_64-apple-darwin.release-metadata.json",
      "sbom": "rune-0.1.3-x86_64-apple-darwin.sbom.json",
      "target": "x86_64-apple-darwin"
    },
    {
      "archive": {
        "name": "rune-0.1.3-x86_64-unknown-linux-gnu.tar.gz",
        "sha256": "d62bc13163b532ab561817e839db93585c78f4cc681893e1991b04a010776f7d"
      },
      "checksum": "rune-0.1.3-x86_64-unknown-linux-gnu.tar.gz.sha256",
      "metadata": "rune-0.1.3-x86_64-unknown-linux-gnu.metadata.json",
      "notices": "rune-0.1.3-x86_64-unknown-linux-gnu.notices.json",
      "provenance": "rune-0.1.3-x86_64-unknown-linux-gnu.provenance.json",
      "release_metadata": "rune-0.1.3-x86_64-unknown-linux-gnu.release-metadata.json",
      "sbom": "rune-0.1.3-x86_64-unknown-linux-gnu.sbom.json",
      "target": "x86_64-unknown-linux-gnu"
    }
  ],
  "version": "0.1.3",
  "workflow": {
    "run_id": "32680323483"
  }
}
